{
  "schema_version": 1,
  "task_id": "EVAL-102",
  "artifact_kind": "ranked-candidate-inventory",
  "status": "candidate-only-not-selected",
  "snapshot_completed_at": "2026-08-25T21:59:36Z",
  "selection_authorized": false,
  "freeze_authorized": false,
  "ground_truth_collected": false,
  "ranking_method": "Candidate-only triage ordered by a clear Node boundary, HTTP/data/message pattern diversity, manageable candidate scope, and recent repository activity. Rank is not a selection decision and must not be used to bypass the Lead protocol gate.",
  "automation_status": {
    "github_api_access": "completed-authenticated",
    "billing_blocked": false,
    "billing_note": "Candidate discovery used the authenticated GitHub REST API and required no paid provider. Any later model/provider billing gate belongs to analyzer execution, not EVAL-102 candidate discovery."
  },
  "blockers": [
    "A human Lead must approve the proposed holdout protocol before final repository selection.",
    "A human must check every candidate against detector, rule, prompt, fixture, pilot, and benchmark tuning history.",
    "Humans must select only 2-3 repositories, define exact scopes and exclusions, and materialize source-tree and environment pins.",
    "Two blind human reviewers must independently annotate ground truth and a human must adjudicate disagreements.",
    "The final manifest, package artifacts, statistical plan, and ground truth require human approval and freeze."
  ],
  "candidates": [
    {
      "rank": 1,
      "id": "hyperdxio/hyperdx",
      "name": "HyperDX",
      "canonical_url": "https://github.com/hyperdxio/hyperdx",
      "github_api_repository_url": "https://api.github.com/repos/hyperdxio/hyperdx",
      "github_api_head_url": "https://api.github.com/repos/hyperdxio/hyperdx/commits/main",
      "default_branch": "main",
      "observed_default_branch_commit_sha": "e0d2932802bf1b315b420a8a4214a6c0691a7835",
      "retrieved_at": "2026-08-25T21:59:36Z",
      "primary_language": "TypeScript",
      "github_snapshot": {
        "size_kib_approx": 56696,
        "stars": 9861,
        "forks": 457,
        "open_issues": 183,
        "pushed_at": "2026-08-25T21:41:16Z",
        "updated_at": "2026-08-25T21:38:55Z",
        "default_branch_commit_committed_at": "2026-08-25T21:37:22Z",
        "archived": false,
        "disabled": false,
        "fork": false
      },
      "license": {
        "spdx_id": "MIT",
        "api_url": "https://api.github.com/repos/hyperdxio/hyperdx/license",
        "path": "LICENSE",
        "blob_sha": "295e7dfdf4e5702c54af5fbab42db890c958fb7c",
        "file_url": "https://github.com/hyperdxio/hyperdx/blob/e0d2932802bf1b315b420a8a4214a6c0691a7835/LICENSE"
      },
      "package_topology": {
        "package_manager": "yarn@4.13.0",
        "monorepo": true,
        "signals": "Yarn workspaces over packages/* with Nx orchestration and a committed Yarn lockfile.",
        "manifest_urls": [
          "https://github.com/hyperdxio/hyperdx/blob/e0d2932802bf1b315b420a8a4214a6c0691a7835/package.json",
          "https://github.com/hyperdxio/hyperdx/blob/e0d2932802bf1b315b420a8a4214a6c0691a7835/yarn.lock",
          "https://github.com/hyperdxio/hyperdx/blob/e0d2932802bf1b315b420a8a4214a6c0691a7835/nx.json"
        ]
      },
      "architecture_evidence": [
        {
          "kind": "http",
          "source_url": "https://github.com/hyperdxio/hyperdx/blob/e0d2932802bf1b315b420a8a4214a6c0691a7835/packages/api/src/api-app.ts",
          "source_blob_sha": "5e336d0d8def544376604e4d641c525074ed8e97",
          "observation": "The API application composes the server-side HTTP surface."
        },
        {
          "kind": "data",
          "source_url": "https://github.com/hyperdxio/hyperdx/blob/e0d2932802bf1b315b420a8a4214a6c0691a7835/packages/api/src/clickhouse.ts",
          "source_blob_sha": "f9bb00910c62b2adf2f5b4b2ed935d9aedfd572e",
          "observation": "A dedicated ClickHouse integration exposes a concrete data boundary."
        },
        {
          "kind": "message",
          "source_url": "https://github.com/hyperdxio/hyperdx/blob/e0d2932802bf1b315b420a8a4214a6c0691a7835/packages/api/src/controllers/webhook.ts",
          "source_blob_sha": "ce791330d63967027f7b4b95a04ca7a1936a12a7",
          "observation": "The webhook controller provides an externally observable event-delivery boundary."
        }
      ],
      "rationale": "A relatively compact, recently active observability system with distinct API, ClickHouse, and webhook boundaries should provide high-value architecture evidence without requiring the largest monorepo scope.",
      "risks": [
        "A runnable scope may require ClickHouse and OpenTelemetry dependencies.",
        "Generated telemetry schemas and integration tests need explicit exclusions."
      ],
      "prior_tuning_leakage_status": "unknown-needs-human-check",
      "selection_decision": "not-evaluated-human-gated"
    },
    {
      "rank": 2,
      "id": "amruthpillai/reactive-resume",
      "name": "Reactive Resume",
      "canonical_url": "https://github.com/amruthpillai/reactive-resume",
      "github_api_repository_url": "https://api.github.com/repos/amruthpillai/reactive-resume",
      "github_api_head_url": "https://api.github.com/repos/amruthpillai/reactive-resume/commits/main",
      "default_branch": "main",
      "observed_default_branch_commit_sha": "3c195dc3f8db5ccae4aa4aff0cefe54980c02b74",
      "retrieved_at": "2026-08-25T21:59:36Z",
      "primary_language": "TypeScript",
      "github_snapshot": {
        "size_kib_approx": 242254,
        "stars": 41728,
        "forks": 4665,
        "open_issues": 118,
        "pushed_at": "2026-08-25T09:35:29Z",
        "updated_at": "2026-08-25T21:48:55Z",
        "default_branch_commit_committed_at": "2026-08-24T19:44:16Z",
        "archived": false,
        "disabled": false,
        "fork": false
      },
      "license": {
        "spdx_id": "MIT",
        "api_url": "https://api.github.com/repos/amruthpillai/reactive-resume/license",
        "path": "LICENSE",
        "blob_sha": "474c93d9dc3f213c2fd6d735162777f6e9022021",
        "file_url": "https://github.com/amruthpillai/reactive-resume/blob/3c195dc3f8db5ccae4aa4aff0cefe54980c02b74/LICENSE"
      },
      "package_topology": {
        "package_manager": "pnpm@11.24.0+sha512.bd27e345e976dcb0be0b7a1228217b049a817e21b1f355c90dbe7dc46671895a8bc1e6d06c24554505ea93ea0b45f489a27ec1bfbc8de6a9659fca0f16fa0000",
        "monorepo": true,
        "signals": "pnpm workspaces cover apps/*, packages/*, and tooling; Turbo coordinates the server and web applications.",
        "manifest_urls": [
          "https://github.com/amruthpillai/reactive-resume/blob/3c195dc3f8db5ccae4aa4aff0cefe54980c02b74/package.json",
          "https://github.com/amruthpillai/reactive-resume/blob/3c195dc3f8db5ccae4aa4aff0cefe54980c02b74/pnpm-lock.yaml",
          "https://github.com/amruthpillai/reactive-resume/blob/3c195dc3f8db5ccae4aa4aff0cefe54980c02b74/pnpm-workspace.yaml"
        ]
      },
      "architecture_evidence": [
        {
          "kind": "http",
          "source_url": "https://github.com/amruthpillai/reactive-resume/blob/3c195dc3f8db5ccae4aa4aff0cefe54980c02b74/apps/server/src/http/app.ts",
          "source_blob_sha": "677f92d5aec4cc0a2953cf529174423a4ea27ebe",
          "observation": "The server package has an explicit HTTP application composition point."
        },
        {
          "kind": "message",
          "source_url": "https://github.com/amruthpillai/reactive-resume/blob/3c195dc3f8db5ccae4aa4aff0cefe54980c02b74/apps/server/src/rpc/handler.ts",
          "source_blob_sha": "0707a30d5430b075de5579f443d273f34da98563",
          "observation": "The RPC handler exposes a separate request/message boundary."
        },
        {
          "kind": "data",
          "source_url": "https://github.com/amruthpillai/reactive-resume/blob/3c195dc3f8db5ccae4aa4aff0cefe54980c02b74/compose.yml",
          "source_blob_sha": "a0378f96a5d8bce8eefb1a2d6e02a226be5f45be",
          "observation": "The deployment manifest makes server-side data and object-storage dependencies inspectable."
        }
      ],
      "rationale": "A recognizable full-stack product with a focused server application, RPC boundary, and deployment-level data services offers a tractable system rather than a library-only target.",
      "risks": [
        "PDF rendering and object storage may make full execution resource-heavy.",
        "The monorepo includes UI and tooling that should be excluded from a server-focused scope."
      ],
      "prior_tuning_leakage_status": "unknown-needs-human-check",
      "selection_decision": "not-evaluated-human-gated"
    },
    {
      "rank": 3,
      "id": "ether/etherpad",
      "name": "Etherpad",
      "canonical_url": "https://github.com/ether/etherpad",
      "github_api_repository_url": "https://api.github.com/repos/ether/etherpad",
      "github_api_head_url": "https://api.github.com/repos/ether/etherpad/commits/develop",
      "default_branch": "develop",
      "observed_default_branch_commit_sha": "d85d254ac093dc0801188fd954751c33b181e45c",
      "retrieved_at": "2026-08-25T21:59:36Z",
      "primary_language": "TypeScript",
      "github_snapshot": {
        "size_kib_approx": 49815,
        "stars": 18507,
        "forks": 3038,
        "open_issues": 18,
        "pushed_at": "2026-08-25T15:26:22Z",
        "updated_at": "2026-08-25T15:46:51Z",
        "default_branch_commit_committed_at": "2026-08-25T15:26:18Z",
        "archived": false,
        "disabled": false,
        "fork": false
      },
      "license": {
        "spdx_id": "Apache-2.0",
        "api_url": "https://api.github.com/repos/ether/etherpad/license",
        "path": "LICENSE",
        "blob_sha": "366aa1a47ada71731706b5c1a2bb0933438f4d02",
        "file_url": "https://github.com/ether/etherpad/blob/d85d254ac093dc0801188fd954751c33b181e45c/LICENSE"